{
  "check_summary": {
    "failed": [],
    "passed": 58,
    "total": 58
  },
  "checks": {
    "H_matches_T34": true,
    "T30_source_is_exact": true,
    "T31_boundary_is_exact": true,
    "T32_radial_action_is_exact": true,
    "T33_source_freeze_is_exact": true,
    "T34_values_are_exact_at_declared_tier": true,
    "absolute_scale_remains_open": true,
    "base_change_newly_closed": true,
    "conditional_matching_uniqueness_newly_closed": true,
    "contract_schema_is_exact": true,
    "counterterm_Hessian_condition_is_exact": true,
    "counterterm_orbit_newly_closed": true,
    "counterterm_slope_condition_is_exact": true,
    "counterterm_value_condition_is_exact": true,
    "determinant_orientation_remains_open": true,
    "external_BV_operator_remains_open": true,
    "external_BV_operator_remains_open_in_source": true,
    "fixed_source_radial_determinant_newly_closed": true,
    "full_QFT_vacuum_remains_open": true,
    "global_determinant_remains_open": true,
    "grassmann_base_change_is_exact": true,
    "handoff_is_pinned": true,
    "held_out_observable_remains_open": true,
    "internal_projector_nonpromotion_is_preserved": true,
    "kernel_model_is_pinned": true,
    "matching_matrix_is_invertible": true,
    "matching_rule_selection_remains_open": true,
    "no_fitted_coefficients_used": true,
    "no_observed_values_used": true,
    "physical_packet_acceptance_unchanged": true,
    "physical_row_acceptance_unchanged": true,
    "precision_transport_remains_open": true,
    "q4_decimal_matches_exact": true,
    "q4_star_is_exact": true,
    "qft_regulator_certificate_passes": true,
    "scheme_cancellation_is_numerically_exact": true,
    "schur_base_change_is_exact": true,
    "schur_high_block_is_invertible": true,
    "sector_map_remains_open": true,
    "source_01_hash_matches": true,
    "source_02_hash_matches": true,
    "source_03_hash_matches": true,
    "source_04_hash_matches": true,
    "source_05_hash_matches": true,
    "source_06_hash_matches": true,
    "source_07_hash_matches": true,
    "source_08_hash_matches": true,
    "source_lock_schema_is_exact": true,
    "source_root_is_nonempty": true,
    "t_RG_fixed_point_remains_open": true,
    "t_star_matches_T30": true,
    "theorem_is_nonempty": true,
    "universal_remainder_first_jet_is_zero": true,
    "universal_remainder_fourth_jet_is_minus64": true,
    "universal_remainder_is_numerically_exact": true,
    "universal_remainder_second_jet_is_zero": true,
    "universal_remainder_third_jet_is_minus16": true,
    "universal_remainder_value_jet_is_zero": true
  },
  "claim_id": "CBF.T35",
  "closure_jet_matching": {
    "T34_radial_coordinate_preserved_at_one_loop_in_this_scheme": true,
    "T34_radial_curvature_preserved_at_one_loop_in_this_scheme": true,
    "conditions": [
      "Delta V(H)=0",
      "Delta V'(H)=0",
      "Delta V''(H)=0"
    ],
    "independent_of": [
      "mu",
      "c_scheme",
      "L4_*"
    ],
    "interpretation": "preserve selected lower action germ through order two",
    "jets_at_x_equal_one": {
      "first": 0,
      "fourth": -64,
      "second": 0,
      "third": -16,
      "value": 0
    },
    "normalized_shape": "rho(x)=x^4(3/2-log(x^2))-2x^2+1/2",
    "physical_scheme_promotion_claimed": false,
    "selected_by_upper_MTT": false,
    "unique_given_conditions": true,
    "universal_remainder": "kappa_F q4_*[h^4(log(H^2/h^2)+3/2)-2H^2h^2+H^4/2]"
  },
  "date": "2026-08-30",
  "fixed_source_four_dimensional_determinant": {
    "L4_star": "sum_a sigma_a^4 log(sigma_a^2)",
    "branch_factors": {
      "-2": {
        "exact_coefficients": {
          "rational": "5/6",
          "sqrt13": "1/6"
        },
        "expression": "(5+sqrt(13))/6",
        "interval": {
          "lower_decimal": "1.434258545910664882186536877912",
          "lower_exact": "1792823182388331102733171097389686655469/1250000000000000000000000000000000000000",
          "upper_decimal": "1.434258545910664882186536877912",
          "upper_exact": "86055512754639892931192212674704959462513/60000000000000000000000000000000000000000"
        }
      },
      "-4": {
        "exact_coefficients": {
          "rational": "2/3",
          "sqrt13": "1/3"
        },
        "expression": "(2+sqrt(13))/3",
        "interval": {
          "lower_decimal": "1.868517091821329764373073755823",
          "lower_exact": "1167823182388331102733171097389686655469/625000000000000000000000000000000000000",
          "upper_decimal": "1.868517091821329764373073755823",
          "upper_exact": "56055512754639892931192212674704959462513/30000000000000000000000000000000000000000"
        }
      },
      "2": {
        "exact_coefficients": {
          "rational": "7/6",
          "sqrt13": "-1/6"
        },
        "expression": "(7-sqrt(13))/6",
        "interval": {
          "lower_decimal": "0.565741454089335117813463122088",
          "lower_exact": "33944487245360107068807787325295040537487/60000000000000000000000000000000000000000",
          "upper_decimal": "0.565741454089335117813463122088",
          "upper_exact": "707176817611668897266828902610313344531/1250000000000000000000000000000000000000"
        }
      }
    },
    "conditional_external_assumptions": [
      "flat Euclidean four-dimensional spectral chart",
      "constant radial field h",
      "dimensionally regulated one-loop fermion determinant",
      "fixed source t=t_*"
    ],
    "fixed_source_flat_radial_determinant_closed": true,
    "flat_one_loop_formula": "V_F(h)=-kappa_F h^4[q4_* log(h^2/mu^2)+L4_*-c_scheme q4_*]",
    "global_physical_determinant_closed": false,
    "q4_star": {
      "exact_coefficients": {
        "rational": "356/27",
        "sqrt13": "25/27"
      },
      "expression": "(356+25sqrt(13))/27",
      "interval": {
        "lower_decimal": "16.523658588392582678814093766176",
        "lower_exact": "3717823182388331102733171097389686655469/225000000000000000000000000000000000000",
        "upper_decimal": "16.523658588392582678814093766176",
        "upper_exact": "178455512754639892931192212674704959462513/10800000000000000000000000000000000000000"
      }
    },
    "source_coordinate": {
      "exact_coefficients": {
        "rational": "1/6",
        "sqrt13": "-1/6"
      },
      "expression": "(1-sqrt(13))/6",
      "interval": {
        "lower_decimal": "-0.434258545910664882186536877912",
        "lower_exact": "-26055512754639892931192212674704959462513/60000000000000000000000000000000000000000",
        "upper_decimal": "-0.434258545910664882186536877912",
        "upper_exact": "-542823182388331102733171097389686655469/1250000000000000000000000000000000000000"
      }
    },
    "t_varied_in_lower_action": false
  },
  "frontier_delta": "CBF.T35 proves that fixed-source evaluation commutes with every finite Grassmann determinant and Gaussian/BV Schur pushforward, so the T30/T34 source coordinate is not re-extremized at one matching scale. It executes the complete flat four-dimensional fixed-source radial determinant and classifies the three gauge-even local counterterms. Requiring preservation of the selected value, slope and Hessian fixes all three uniquely and emits a mu-, scheme- and branch-log-independent remainder with exact third/fourth jets -16 and -64. The matching requirement, external BV operator/domain, determinant orientation and beta_t remain open, so this is not a physical renormalized vacuum or pole-mass promotion.",
  "numerical_execution": {
    "H_over_Lambda": "1.3211016293754684937241140791004495525427156531826718660431761370691619814324325",
    "H_squared_over_Lambda_squared": "1.7453095151385177185351833627423326105972038607898213139211878958779922997321935",
    "L4_star": "18.176066017544062361087042190541135501620313031067563880808957659162441858734842",
    "MSbar_mu_equals_Lambda_per_unit_kappa": {
      "delta_Omega_over_Lambda4": "25.166402030762203107652489949813027914755455378748843861986875432483969254473580",
      "delta_lambda": "27.378618796640755205528363179817484496677926703979373100574185483012425714240522",
      "delta_m2_over_Lambda2": "-57.677797118443725188553711550295305100654425517725575708086889110399918032625748",
      "fourth_vertex_shift": "-1057.5141496571252914441020010352886486667435006723108866791379588875358191581043",
      "third_vertex_shift_over_Lambda": "-349.27091654991031471190027512881164041203723941862506902745582141783249592994709"
    },
    "determinant_normalization_candidates": {
      "complex_determinant": {
        "delta_Omega_over_Lambda4": "2.5498896417757594062541426341643663278491832426327065612695927765039864147134620",
        "delta_lambda": "2.7740340629679987264832734987851426367163488325242335364965740955075116245593030",
        "delta_m2_over_Lambda2": "-5.8439826739233370178845151639232064424085070149092893649215566378862474670920958",
        "fourth_vertex_shift": "-107.14858536178026106946328017798887527649891573576105395827498242645692811041242",
        "kappa_F": "0.10132118364233777144387946320972763890435877467224654884560907009984499272331742",
        "third_vertex_shift_over_Lambda": "-35.388542676681093797342628808970970549699138888892878418659675446885864347405505"
      },
      "pfaffian_half": {
        "delta_Omega_over_Lambda4": "1.2749448208878797031270713170821831639245916213163532806347963882519932073567310",
        "delta_lambda": "1.3870170314839993632416367493925713183581744162621167682482870477537558122796515",
        "delta_m2_over_Lambda2": "-2.9219913369616685089422575819616032212042535074546446824607783189431237335460480",
        "fourth_vertex_shift": "-53.574292680890130534731640088994437638249457867880526979137491213228464055206209",
        "kappa_F": "0.050660591821168885721939731604863819452179387336123274422804535049922496361658711",
        "third_vertex_shift_over_Lambda": "-17.694271338340546898671314404485485274849569444446439209329837723442932173702753"
      }
    },